<?xml version="1.0" encoding="UTF-8"?>
<flowers xmlns:xsi="http://www.w3.org/2001/XMLSchema-instance"
         xsi:schemaLocation="http://www.example.com/flowers flowers.xsd"
         xmlns="http://www.example.com/flowers">
    <annual id="abaa2a-faa8-4f55-bf51-d812411e571f" name="aster">
        <soil>podzolic</soil>
        <visual>
            <colorFlower>red</colorFlower>
            <colorLeaves>green</colorLeaves>
            <averageSize>40</averageSize>
        </visual>
        <growing>
            <temperature>10-30C</temperature>
            <lighting>800FC</lighting>
            <watering>medium</watering>
        </growing>
        <plantingTime>april</plantingTime>
    </annual>
    <perennial id="fb774a46-3c49-4174-b562-3dbd36671cc3" name="peony">
        <soil>land_based</soil>
        <visual>
            <colorFlower>pink</colorFlower>
            <colorLeaves>green</colorLeaves>
            <averageSize>100</averageSize>
        </visual>
        <growing>
            <temperature>0-35C</temperature>
            <lighting>600FC</lighting>
            <watering>medium</watering>
        </growing>
        <evergreen>false</evergreen>
        <rootType>fibrous</rootType>
    </perennial>
</flowers>